StartDate,EndDate,Status,IPAddress,Progress,Duration..in.seconds.,Finished,RecordedDate,ResponseId,RecipientLastName,RecipientFirstName,RecipientEmail,ExternalReference,LocationLatitude,LocationLongitude,DistributionChannel,UserLanguage,consent,ProlificID,HS,RH.S,HO,RH.O,scale.1,scale.2,scale.3,scale.4,scale.5,explain.1,explain.2,Basic.Q1,Basic.Q1_4_TEXT,Basic.Q2,Basic.Q3,Basic.Q3_8_TEXT,Cultural.demo,Religion.belief.Q1,Religion.belief.Q2,Religion.belief.Q3,Religion.belief.Q4,Self.harm.experience,Self.harm.experience.1,Self.harm.experience.2
2025-03-28T14:31:42Z,2025-03-28T14:42:35Z,0,172.4.58.246,100,653,1,2025-03-28T14:42:36Z,R_580Zo8Szhbg9HAl,NA,NA,NA,NA,34.1626,-118.1273,anonymous,EN,1,655f8e46111e1df6951e1ede,NA,NA,"Sarah's decision to end her life is causing harm to her husband and daughter. Her husband will be lonely and forced to raise the daughter by himself, which is extremely difficult. I'm assuming it also costs money to die, so he'll have to use money and might not be in a financially stable place. Also her daughter is young and now has to live without a mom. She'll never get to experience traveling with her mom, spending time with her mom. Her daughter might grow up bullied and depressed without a mom.",NA,7,7,6,3,3,"Since the age of 13 my mom has been crippled. She slowly was unable to do everyday things. At 13, I began to bathe my mom and helped her shower. I slowly began to take on more and more duties as time passed. Although I resent her, I wouldn't want her to have killed herself. Life was difficult for me, being her caregiver, and I'm still doing the caregiving for her. However, if she died, I think I would be very sad. She is in chronic severe pain, she hasn't been able to move from her bed for many years now. She can't even stand, I literally have to push her around on a stool because she can't even bend her knees to get into a wheelchair. My mom tells me she wants to die sometimes, but I know I'll be sad if she does. So it was definitely from personal experience.",I also think killing yourself is a selfish act. Think about others too.,2,NA,31,2,NA,"My parents are immigrant parents from Vietnam. They told me that I had duties to take care of them when I'm older. I don't believe in that. I can help them at a distance, but because I grew up with toxic parents who were emotionally abusive, I became resentful. However, I still help them out of guilt, especially my mom who is crippled.",1,NA,2,2,2,2,13
2025-03-28T14:30:15Z,2025-03-28T14:43:20Z,0,73.225.193.92,100,785,1,2025-03-28T14:43:21Z,R_35JwG3QizO9NWSd,NA,NA,NA,NA,47.1101,-122.775,anonymous,EN,1,665cd4701ff1b137156430c7,NA,"Sarah's choice not only avoids the physical suffering she would have had to endure, but also the mental suffering and worry she would have felt from allowing her daughter to witness her life slowly withering away due to illness.",NA,NA,3,6,2,4,5,No person should be forced to endure a life of suffering. I have personally watched a relative suffer through a terminal illness. That experience has made me firmly believe in an individuals right to die (euthanasia).,"""My body, My choice""",1,NA,28,5,NA,NA,1,NA,2,2,1,1,123
2025-03-28T14:30:18Z,2025-03-28T14:43:21Z,0,168.235.145.37,100,782,1,2025-03-28T14:43:21Z,R_13RyrxksPsfvr7X,NA,NA,NA,NA,33.9558,-118.3893,anonymous,EN,1,67e4608869f902640c3cff63,NA,NA,The act of choosing death to relieve her extreme suffering leads Sarah to hurt her family members especially her husband along with her daughter. The loved ones of Sarah mourn her departure together with the way she decided to die which often creates internal conflicts between blame and inability to stop her suffering. As a young and susceptible individual her daughter faces difficulties understanding how someone would choose this instead of continuing to live. Consequently she might develop troubled emotions or inappropriate views about facing both obstacles and suffering. The death would generate enduring mental health consequences that may produce feelings of being deserted together with self-image problems. The grief his daughter faces will be accompanied by emotional pain because he must perform both roles of caretaking for their daughter while supporting himself during his grief and loss.,NA,4,6,4,6,5,The basis of my decision came from understanding how Sarah's family members would be affected emotionally by her decision. My analysis concentrated on the wider family effects that result from Sarah's choice despite recognizing her motivation to reduce pain while her family acknowledged her suffering. Research about how family members respond to care decisions originated from understanding that people commonly fail to understand how their actions to reduce personal pain can seriously influence those around them.,My evaluation further incorporated ethical principles about both individual freedom and mutual relational responsibilities as well as emotional worries for Sarah's daughter. I both protect Sarah's freedom to decide about her body and accept that every choice creates influence on people who care about her. Relational duty and personal freedom combined to dominate my judgement process.,2,NA,30,3,NA,"""I come from a multicultural background where my mother is from Nigeria, and my father is from the United States. Growing up, I was exposed to the vibrant traditions, languages, and values of both cultures. From my Nigerian heritage, I learned the importance of community, respect for elders, and rich storytelling through music and dance. From my American upbringing, I embraced the values of individuality, freedom of expression, and diversity. This blend of cultures has shaped my worldview, teaching me to value different perspectives and adapt to various social settings.""",2,Christian,1,2,2,1,3
2025-03-28T14:34:33Z,2025-03-28T14:43:57Z,0,174.250.193.37,100,563,1,2025-03-28T14:43:57Z,R_5KmQuH3QUHWmJSV,NA,NA,NA,NA,39.1027,-94.5925,anonymous,EN,1,63e5fca99d84c2b8004e82df,NA,NA,NA,"Sarah's decision to end her life reduced harm to everyone mentioned in this story. It reduced harm to herself because she no longer had to suffer. It reduced harm to every family member because they no longer had to see her live a life that was unbearable and that they knew she didn't want. It reduced harm to her daughter in the sense that her hurt daughter does not have to see her mom an extreme pain every moment of her life , from now on.",2,6,2,6,9,My whole life I have hated to see things suffer. The point in life is to be able to have an experience that is at least neutral. If dissatisfaction is the overall theme of a life is it a life worth living? I don't think so.,"I think that a lot of times we get to zoom in to a concept and deseparate it from the other elements.And for example, in this one it would be.We get too zimmed into the idea of life and death and separate from what makes life meaningful.",1,NA,46,5,NA,My family is historical lyrics western European but my parents and myself were born in usa.,1,NA,1,1,2,2,13
2025-03-28T14:37:49Z,2025-03-28T14:44:34Z,0,216.57.140.16,100,404,1,2025-03-28T14:44:34Z,R_3lmFQ1dyVTpjTS0,NA,NA,NA,NA,35.2522,-80.8263,anonymous,EN,1,668b1a84ce6cb1fdb760d4d3,NA,"Sarah will no longer be in pain, will no longer need to suffer while knowing the suffering will only lead to death in a relatively short time period during which the pain may get worse.",NA,NA,2,7,5,5,5,Sarahs decision. Along partially with personal experience.,"People should decide if they live or not, especially if their life is full of pain/suffering",1,NA,30,8,mixed,i have a background of a well travelled family that allowed me to gain different perspectives and thought ideas.,1,NA,1,1,2,2,5
2025-03-28T14:39:26Z,2025-03-28T14:44:36Z,0,107.115.165.26,100,309,1,2025-03-28T14:44:37Z,R_56nAE6fh6TBSKZ2,NA,NA,NA,NA,28.0109,-82.4948,anonymous,EN,1,66fa11a8d9cb228136e0e348,NA,NA,NA,By not making them witness her prolonged pain and suffering,2,6,2,6,5,Her pain,None,2,NA,48,5,NA,Born of native American Indian and white with scots-irish English & dutch.,2,Christian,1,1,1,1,1
2025-03-28T14:37:29Z,2025-03-28T14:45:14Z,0,166.198.248.37,100,464,1,2025-03-28T14:45:14Z,R_72nKuTnrqNl3xpG,NA,NA,NA,NA,39.8704,-86.2166,anonymous,EN,1,655971c4a36af682da4669ff,NA,She is forgoing pain for her and her family,NA,NA,3,5,3,5,5,If Sarah believes she is forgoing drawn out pain then I support her,I am not in Sarah's head so won't judge,1,NA,47,5,NA,"I come a fairy of trauma, my mom passed early and my father was paralyzed in an accident when I was a kid.",3,Protestant,1,1,1,1,12
2025-03-28T14:35:44Z,2025-03-28T14:45:39Z,0,66.188.73.61,100,594,1,2025-03-28T14:45:39Z,R_3vdjg0u73WgXTDs,NA,NA,NA,NA,33.0787,-83.2376,anonymous,EN,1,5dcfcf3b070fdc0d5fd1952c,NA,NA,NA,It frees them from the present and future burden of spending time and other resources on taking care of her. It saves them from witnessing and then remembering what might have been bad pain or circumstances as she got worse. It would save them money because being sick is expensive.,5,6,4,5,7,In the scenario Sarahs focus on her own issues was highlighted but realistically consideration of others would factor into a decision. I know that from personal experience. So I answered from the story given and my own kniwledge,NA,2,NA,63,5,NA,I grew up in NYC but have lived in a rural Georgia area for 40 years.,1,NA,3,3,2,2,3
2025-03-28T14:31:58Z,2025-03-28T14:45:50Z,0,172.56.80.32,100,832,1,2025-03-28T14:45:50Z,R_6prgMPqq00Pr2lr,NA,NA,NA,NA,33.5613,-112.1442,anonymous,EN,1,5e2926d80beb030ede110e67,NA,NA,NA,"I suppose that by ending her life, her family doens't have to care for her and see the sickness and tragic experience of watching a loved one slowly dying. Now they can move on with life and remember Sarah for the good times they had with her.",3,6,3,5,5,"I'm a very devout Christian and I believe in giving my pain to Jesus and allowing Him to use that pain to glorify Him, so my beliefs are a little different from the average person who just views pain as bad. I would no longer end my own life due to pain because I believe God has a plan however I don't think that Sarah's decision to end her life dooms her to hell like some Christians do. Only God will judge and only He knows her heart.","I can't say what I would do in the situation, only what I think based on pain that is often unbearable in my own life as well as a desire to end my life many times which I would never act on.",2,NA,52,5,NA,"The maternal side of my family is Irish and German and my paternal side is Italian. But, we have all been raised in the US. Americans all the way back to my great grandparents. Mainly exposed to Protestant faith, but little religious influence.",4,"Christian, Protestant but leaning towards Catholicism in many of my thoughts.",1,1,2,2,3
2025-03-28T14:42:07Z,2025-03-28T14:45:53Z,0,184.19.49.71,100,225,1,2025-03-28T14:45:53Z,R_1KkbZOV4Hqzg3x6,NA,NA,NA,NA,41.6106,-87.0642,anonymous,EN,1,5c7a19f0419b5600170211ec,"It causes harm to herself because it doesn't give her the extra time with her family that she could've had,",NA,NA,NA,5,5,4,3,5,She was wanting to ease her own pain but I don't think that it's morally wrong to want to do so especially as she's continuing to get worse. Her family would've had to deal with her death either way.,I had a sick parent when I was growing up who knew she was going to die within years and she stayed around but I wouldn't have blamed her for doing what Sarah did.,2,NA,27,5,NA,I don't really have any cultural background. I came from a white family in the United States.,1,NA,1,1,1,1,123
2025-03-28T14:39:14Z,2025-03-28T14:46:12Z,0,74.128.75.56,100,418,1,2025-03-28T14:46:12Z,R_6jU6CTZKV6hj0Yh,NA,NA,NA,NA,38.9924,-84.6462,anonymous,EN,1,672f62bfadeed82594666b53,NA,She is ending the equation. The only thing she knows is that her condition will get worse from a place that is already unbearable physically and emotionally. In a sense she is getting out on top.,NA,NA,7,7,3,5,5,I myself have a painful chronic condition. My future is uncertain but her's was not I can only assume we have comparable trains of thought and she took took the way that I would if my future was certain.,NA,1,NA,29,5,NA,WASP family from the suburbs outside of a city.,1,NA,3,3,2,1,5
2025-03-28T14:41:23Z,2025-03-28T14:46:47Z,0,69.84.61.105,100,324,1,2025-03-28T14:46:48Z,R_5zZ1JkWY7cqfb8d,NA,NA,NA,NA,41.022,-80.6659,anonymous,EN,1,57a9f41a16a091000112f1cf,NA,Sarah was in pain and knew it would get worse. She ended her life to stop the suffering and find peace.,NA,NA,3,6,4,5,5,Sarah’s choice to ease her pain influenced my judgment the most.,NA,1,NA,25,5,NA,I come from the average upper middle class northeast white family,1,NA,2,3,2,2,5
2025-03-28T14:39:19Z,2025-03-28T14:47:13Z,0,107.139.230.235,100,473,1,2025-03-28T14:47:13Z,R_7mSS2w0bd7k29qh,NA,NA,NA,NA,34.118,-118.3303,anonymous,EN,1,63345f710321e08d1720919e,NA,NA,NA,she has a terminal illness and she trys to hide her discomfort from her family but they notice that she is suffering. instead prolonging the misery she decides to end the suffering for everyone by taking her own life.,4,7,3,5,6,The fact that she was terminally ill and wanted to ease the pain on bother family and herself. while she has a easily impresionable daughter i think she wanted to end the pain for them as well as herself so they wouldnt have bad memories.,I feel like if she is really terminal that the decision should ultimately be hers .,1,NA,37,2,NA,I come from a multicultural household. Are family was not really close but I now have a lot of respect for all the sacrifices my parents had to make.,3,Presbyterian,2,2,2,1,5
2025-03-28T14:42:14Z,2025-03-28T14:47:13Z,0,47.37.33.5,100,299,1,2025-03-28T14:47:14Z,R_5aQfRdF81BaGbVA,NA,NA,NA,NA,43.9282,-105.5492,anonymous,EN,1,677c81fbfd4a9fcb98d06224,NA,NA,Her husband and daughter are left to mourn the loss of her. Her daughter is young and impressionable so her daughter seeing that her mother gave up can have a negative impact on her. Her daughter may also struggle trying to understand why her daughter wasn't important enough for Sarah to live for.,NA,7,5,7,4,5,It was Sarah's decision that led me to my judgment in addition to my personal background as a nurse and someone who knows many people who have battled depression and suicidal ideations.,N/A,2,NA,38,5,NA,"American, Caucasian",4,Christian,1,1,1,1,123
2025-03-28T14:41:17Z,2025-03-28T14:47:46Z,0,71.60.34.130,100,388,1,2025-03-28T14:47:46Z,R_56Zzg5lqOcgEFln,NA,NA,NA,NA,40.4562,-79.8163,anonymous,EN,1,5e9dc87fa311c01108463305,NA,NA,"Really, the main issue is depriving her family of time spent with her. However, being that she was suffering, I doubt the time would’ve been very fulfilling. I personally don’t think that her decision is causing harm. Rather, the decision to languish and subject her family to the prolonged suffering and horrors of death is more harmful.",NA,2,7,3,5,5,Personal experience. I watched my grandmother suffer through her final months. She didn’t want to continue and I didn’t want to watch her in pain. We put animals to sleep and we should do it with humane. It’s humane.,I don’t have any strong moral or religious feelings towards euthanasia.,1,NA,38,5,NA,"I come from a very insular community. Predominantly white, Christian and middle class.",3,Catholic,1,1,2,1,3
2025-03-28T14:43:03Z,2025-03-28T14:47:52Z,0,107.2.218.168,100,288,1,2025-03-28T14:47:52Z,R_7CUsSfR2d1Sr92h,NA,NA,NA,NA,39.614,-104.9602,anonymous,EN,1,6100b9bc3ca21392600e905c,NA,NA,NA,"This brings a great deal of pain, sadness, etc. to her family. She had some years to live, but chose to end her life. It was an earlier loss than expected.",7,6,6,5,3,"It was Sarah's decision to end her own pain, but it caused a great deal of pain to her family. I don't have any personal experience with this, but I can sort of imagine.",Not necessarily. I would just be hurt.,1,NA,23,2,NA,"I'm white and Korean. My mom was born in Korea, so I have some cultural diversity.",4,Christian,1,1,2,1,5
2025-03-28T14:43:20Z,2025-03-28T14:48:01Z,0,104.231.97.46,100,281,1,2025-03-28T14:48:01Z,R_5gR9FbJipomvrbL,NA,NA,NA,NA,41.6868,-81.3399,anonymous,EN,1,590208c89571f50001c666e3,NA,NA,"Her family will have less time with her. They have to confront her immediate, chosen death. This will obviously be very upsetting. Some people can't even comprehend choosing to end it rather than going the ""natural"" way. They might face judgment from others, such as around the community. The daughter might get depressed and think that she can end it too. The father will have to raise the child himself and not have those extra years.",NA,2,7,2,5,9,It is a humane option and one that only the person is entitled to. Everyone has the right to choose their own destiny. That is freedom; that is bodily autonomy. Sarah is terminal and suffering.,It is unfortunate that our society is such that one's dying can be a burden. That is a failure of society but doesn't change the situation as is.,1,NA,37,5,NA,"Regular, single-parent, white Christian household in the US.",1,NA,3,3,1,2,1234
2025-03-28T14:42:05Z,2025-03-28T14:48:24Z,0,73.145.164.116,100,378,1,2025-03-28T14:48:24Z,R_1YVTLFl0g3Xx4Cn,NA,NA,NA,NA,42.2807,-83.7801,anonymous,EN,1,60fdc542fe54c5c79401516b,NA,NA,"She is leaving her daughter and partner, who may depend on her. Additionally, if her daughter is impressionable, it might be hard for her to understand why her mother chose to make the decision she did and not internalize it",NA,4,4,5,4,5,"I think she was suffering, and though her family may have wanted more time with her, ultimately, she was not happy or comfortable. I think it is her choice how to spend the remainder of her days. I think to some level, her family needs to understand that. At the same time, it puts them in a very difficult position",NA,2,NA,24,5,NA,"My grandparents were immigrants that lived with my family growing up, thus we had a lot of traditions that they brought. We were also moderately religious and went to Catholic school, though my immediate family no longer practices",2,Roman Catholic,2,2,1,2,123
2025-03-28T14:44:43Z,2025-03-28T14:48:58Z,0,50.124.0.238,100,254,1,2025-03-28T14:48:59Z,R_6mjj1DUM51oaNep,NA,NA,NA,NA,44.6661,-84.6936,anonymous,EN,1,60b49cb1dc5470789edd23fe,NA,NA,It's causing them emotional pain. But she was also in pain. Stop acting like Sarah is a fucking villain here.,NA,7,2,4,3,1,I'm not judging anyone.,none,2,NA,34,5,NA,White,1,NA,3,3,2,1,1
2025-03-28T14:23:04Z,2025-03-28T14:49:05Z,0,89.23.87.141,100,1560,1,2025-03-28T14:49:05Z,R_6CBfrQ3wa9FPLh6,NA,NA,NA,NA,39.2889,-76.623,anonymous,EN,1,67deb1e0f61cefcb495111d4,NA,"Sarah's terminal disease was maybe taking a toll on her and the only option was to end her life to stop the depression she had maybe.
Sarah was maybe going through a lot of things in some instances she couldn't figure a way by her own and was worried that she is incompetent thus resided to end her life.",NA,NA,2,7,4,4,5,What influenced my judgement was that Sarah wanted to ease the stress her family was going through because she was already assured that she has minimal time left to live thus wanted them to worry no more by ending her life.,Sarah had a chronic illness that was troubling her thus was not able to live life normally thus resolved to end the misery.,1,NA,62,5,NA,NA,3,Christianity,1,1,2,1,5
2025-03-28T14:45:54Z,2025-03-28T14:49:19Z,0,99.20.133.79,100,204,1,2025-03-28T14:49:19Z,R_6FcL0eHhvZC1HwJ,NA,NA,NA,NA,28.5504,-81.1833,anonymous,EN,1,672ea4ede62de595adbb6ba6,NA,NA,"It causes harm to others because her daughter will no longer have a mother, which makes her life harder.",NA,3,7,5,3,5,It was Sarah's decision that brought me to arrive at my judgement.,NA,1,NA,20,5,NA,"I was raised in the suburbs of Palm Beach, Florida by white people.",2,Christian,1,2,2,2,5
2025-03-28T14:43:25Z,2025-03-28T14:50:10Z,0,66.58.195.153,100,405,1,2025-03-28T14:50:10Z,R_5aJo1Pf3J1gPnvf,NA,NA,NA,NA,61.3214,-149.5678,anonymous,EN,1,6362f52769cf6894dc6fcde9,I don't think that she is harming herself - I believe that medically assisted suicide is very ethical regarding the well-being of terminally ill people.,NA,NA,NA,1,7,4,7,9,"All of the above - I support the decision to ease everyone's pain.
If she lived through all of the pain & suffering, dying because of the illness, not only would she have been in more pain, but her family would have to suffer seeing her suffer. I have a history of suicidal ideation & suicide attempts due to mental health reasons - this is primarily what has informed my opinion.","I also believe that it is empowering to both Sarah & the family that she, ""she got to go out on her own terms."" It is demoralising for a terminally ill person as well as their family to have the sword of Damocles hanging over their head, waiting for the inevitable.",4,non-binary,29,8,pacific islander + white,hawaiian,1,NA,3,2,1,1,1234
2025-03-28T14:31:53Z,2025-03-28T14:51:57Z,0,68.0.91.37,100,1204,1,2025-03-28T14:51:58Z,R_5Pj0IIWqGaqBMRz,NA,NA,NA,NA,36.0496,-95.8858,anonymous,EN,1,673e455319a8fae8eb74f5a4,NA,"Living and enduring chronic pain can cause one to act in ways that do no reflect their true personality and intentions. This can harm themself, their self-view, and the people around them, especially if there is no possibility for a better quality of life. Ending her life is distressful to those around her for a period of time, but there is possibility for them to heal from this, as opposed to having to deal with helplessness of not being able to reduce her pain.",NA,NA,1,6,3,5,6,"I have not had personal experience with someone ending their life. However, I have had my grandmother, who dealt with great pains after her several operations on her large intestine. She was strong and made efforts to fight the pain everyday with many medications, but she always made some comments about ending her life being a better alternative. When she passed away, I had the same sentiment of being sad and missing her, but also being glad that she was finally at peace.",NA,2,NA,29,7,NA,I was born in Argentina and absorbed some of the culture there before coming to the USA and being raised here in South Florida. I have absorbed many different cultures as a result.,2,Catholic Christian,1,1,1,2,23
2025-03-28T14:42:47Z,2025-03-28T14:53:41Z,0,73.236.118.65,100,654,1,2025-03-28T14:53:42Z,R_1QiNnBQR5M15Wm1,NA,NA,NA,NA,40.6253,-78.6378,anonymous,EN,1,676f10f98ebd608c52a18a2a,NA,NA,her daughter has to grow up without a mom. her husband is without his wife he loves so much and her family is missing her also.,NA,7,1,5,1,5,i have heart disease so i can relate to how she is feeling with everything in life around her. hits home for me.,my own health and emotions toward it.,1,NA,44,5,NA,i come from a german and italian family where everyone is a nut.,1,NA,1,1,1,1,4
2025-03-28T14:36:25Z,2025-03-28T14:53:56Z,0,76.244.26.60,100,1050,1,2025-03-28T14:53:56Z,R_5OrA9K28bKf3n9V,NA,NA,NA,NA,38.2132,-84.5455,anonymous,EN,1,6610490691f72e42aa124c90,"Other than the harm of taking her own life, and missing out on time she could have spent with her daughter, I'm not sure that this decision really causes her harm versus having relief from chronic pain. She has a chronic terminal illness and the doctors say she has less than five years left to live. It's possible that in five years, there could be a cure. It's possible that she has been misdiagnosed. But, I can't imagine being in constant severe pain and knowing the possibility that it could get worse. It's a very difficult situation and it's hard to say that she is causing harm to herself as she may have felt this was the best solution for her particular circumstances.",NA,NA,NA,5,6,5,5,5,"I have lost relatives to cancer, specifically my own father. He had colorectal cancer that metastasized to his brain and other parts of his body. While enduring chemotherapy, the VA doctors did not monitor his condition well, and he ended up having his leg amputated. After that, they refused to give him further testing because his file stated he was ""terminal"". I personally witnessed my Dad endure a lot of suffering. After radiation on his brain, he got a blood clot in his remaining leg. He made the decision rather than suffer with the effects of the cancer, he would allow the blood clot to remain in his leg and he would allow it to take his life. And that is what caused his death in the end. He did not want to endure any more surgery, or live without two legs, or endure more radiation or chemotherapy. In his mind, it was the faster way to end his suffering. While it was not suicide, it was him choosing his own ending. I think that is why I can understand Sarah's decision somewhat. On the other hand, without knowing every detail of her life, it's hard to judge whether it was the best decision in my eyes.",No.,2,NA,51,8,White and Asian,"I come from a multicultural family. My mother was from the Netherlands, but was part Dutch and part Indonesian. Her parents were former POW's by the Japanese during the war. She emigrated to America when she was a teenager and became a citizen. My father was from Kentucky. I grew up with several different cultures. My mother introduced us to various Dutch customs and Indonesian foods. My father was a man of great faith and he influenced my religious beliefs. He was also a pastor in a Southern Baptist Church, however, today, I just consider myself a Christ follower and not a part of a specific religious organization. My father also brought a more southern culture to our family - that from the area of Western Kentucky and the area of Tennessee that borders it.",3,"Formerly Southern Baptist, but currently, I consider myself a Christ follower and I do not identify with any religious organization.",1,3,2,2,5
