StartDate,EndDate,Status,IPAddress,Progress,Duration..in.seconds.,Finished,RecordedDate,ResponseId,RecipientLastName,RecipientFirstName,RecipientEmail,ExternalReference,LocationLatitude,LocationLongitude,DistributionChannel,UserLanguage,consent,ProlificID,HS,RH.S,HO,RH.O,scale.1,scale.2,scale.3,scale.4,scale.5,explain.1,explain.2,Basic.Q1,Basic.Q1_4_TEXT,Basic.Q2,Basic.Q3,Basic.Q3_8_TEXT,Cultural.demo,Religion.belief.Q1,Religion.belief.Q2,Religion.belief.Q3,Religion.belief.Q4,Self.harm.experience,Self.harm.experience.1,Self.harm.experience.2
2025-03-28T14:02:50Z,2025-03-28T14:06:24Z,0,109.121.38.10,100,214,1,2025-03-28T14:06:24Z,R_72xICZTWW3h8dmX,NA,NA,NA,NA,40.7126,-74.0066,anonymous,EN,1,67d214aa576da549539982c4,NA,NA,"Emotional Harm to Her Family – While her family may find solace in knowing she is no longer suffering, they will likely experience deep grief, loss, and sadness. Her husband and daughter may struggle with feelings of abandonment, guilt, or even anger, questioning whether there was anything more they could have done to support her. Her daughter, especially being young and impressionable, may have difficulty processing the loss and could carry emotional scars into adulthood.

Psychological Impact on Her Daughter – Losing a parent to suicide can have long-term psychological effects on a child. It may shape how her daughter views life, death, and coping with adversity. She might struggle with feelings of insecurity, develop fears of abandonment, or even internalize harmful ideas about handling suffering and hardship.

Impact on Medical and Social Support Systems – Sarah’s choice to end her life may also affect the doctors, caregivers, and support networks involved in her care. Healthcare providers and mental health professionals may feel a sense of failure or distress, questioning whether they could have done more to help her manage her condition. Additionally, her decision might discourage others facing similar struggles from seeking palliative care, psychological support, or alternative solutions for managing chronic illness.",NA,4,6,6,6,8,"Consideration of Familial Impact: Understanding the profound emotional and psychological effects that suicide can have on surviving family members, especially children, has shaped my perspective. Studies indicate that losing a parent to suicide can lead to long-term psychological challenges for children, including feelings of abandonment and increased risk of mental health issues.​

Emphasis on Palliative Care: Insights from palliative care emphasize the importance of comprehensive support for terminally ill patients. Effective palliative care can alleviate suffering and improve quality of life, potentially influencing decisions regarding end-of-life choices.​

Ethical and Societal Considerations: The ongoing societal and ethical debates surrounding euthanasia and assisted suicide contribute to a nuanced understanding of the complexities involved in such decisions. Awareness of diverse viewpoints and the potential implications of legal and moral frameworks informs a balanced perspective.","Increased Risk of Suicide and Psychiatric Disorders in Children: Research indicates that children who lose a parent to suicide are at a significantly higher risk of developing psychiatric disorders and are more likely to die by suicide themselves. ​
Child Development Institute

Emotional and Social Development Challenges: Children who experience a parent's suicide often face profound challenges in their emotional and social development, including difficulties in forming relationships and regulating emotions. ​
Psychvarsity

Complicated Grief Process: The self-volitional nature of suicide can complicate the grieving process for children, leading to feelings of isolation, abandonment, and responsibility. ​
PubMed

Ethical and Societal Implications of Euthanasia: The ongoing debates and concerns surrounding euthanasia, including the potential for a ""slippery slope"" effect, highlight the complexities and ethical dilemmas associated with end-of-life decisions. ​
Wikipedia
+1
Latest news & breaking headlines
+1",2,NA,26,5,NA,white,4,christian,1,1,1,1,14
2025-03-28T14:01:53Z,2025-03-28T14:06:27Z,0,76.152.91.21,100,273,1,2025-03-28T14:06:27Z,R_6iP7J4IOfTt7OIK,NA,NA,NA,NA,41.759,-70.4939,anonymous,EN,1,5b915c9d22d85d000115c0f5,NA,NA,NA,Her family doesn't have to witness her in discomfort and suffering. Her family will know she is no longer in severe pain and that she will not longer suffer from her symptoms. They know she is no longer in pain and can finally rest.,1,7,4,7,8,"It was both. Sarah eased her own pain and in doing that, ultimately she eased the pain of her family. She no longer had to suffer and her family didn't have to endure watching her suffer.",no,2,NA,39,5,NA,"I don't come from a diverse background, my family members are very similar and I haven't lived anywhere outside of the USA.",1,NA,2,2,2,2,5
2025-03-28T14:01:03Z,2025-03-28T14:07:18Z,0,68.202.132.174,100,374,1,2025-03-28T14:07:18Z,R_37BQ6SC2VczQvAU,NA,NA,NA,NA,28.6354,-81.4888,anonymous,EN,1,5d096e2b90da3200157ca84b,NA,"She is reducing harm to herself by ending her suffering and the discomfort she experiences from her chronic, terminal illness. She reduces her pain and any emotional/psychological/physical trauma that incurs from her illness.",NA,NA,5,4,5,6,8,"For me, it was both. I personally witnessed a close family member pass away from cancer. Watching them suffer with pain and discomfort towards the end was horrible, especially since they were such a wonderful person. Also knowing Sarah's background with her illness, alongside her family situation, it made sense that she chose to do what she did.",No other particular reasons that influence my judgement.,2,NA,26,5,NA,"My immediate family has no particularly outstanding cultural background. However, my extended family consists of multicultural members that have helped expand my understanding of different backgrounds, traditions, and so on.",2,Christian,2,2,2,1,3
2025-03-28T14:03:27Z,2025-03-28T14:08:09Z,0,167.253.20.158,100,282,1,2025-03-28T14:08:10Z,R_7Nbk8cb0iybYWBo,NA,NA,NA,NA,37.751,-97.822,anonymous,EN,1,67e47edf8c1ce7fa314b51c1,NA,NA,NA,"Sarah’s decision to end her life can be seen as reducing harm to others in several ways. Firstly, by choosing to end her life, Sarah is preventing herself from experiencing severe pain and suffering that would have only worsened over time. This decision can be seen as an act of compassion towards herself, as she does not want to burden her family with the emotional toll of watching her suffer",5,6,5,6,7,no,no,1,NA,22,5,NA,i am an american both parents are white,4,christian,1,1,2,1,134
2025-03-28T14:04:10Z,2025-03-28T14:08:13Z,0,99.99.195.3,100,242,1,2025-03-28T14:08:13Z,R_3ilIWiUjdk4qtK8,NA,NA,NA,NA,33.1976,-96.6178,anonymous,EN,1,60a075bcc900389813dd06b0,"She is ending her life, which is the ultimate harm you can cause to herself. At the same time, if she has to endure awful living conditions, it may be worth it to her.",NA,NA,NA,3,4,4,3,5,"I believe at the end of the day it is up to the person that commits the act. In her scenario, I believe that the conditions she was going through help me understand the decision.",No,1,NA,24,5,NA,"I come from a white family in suburban texas. I grew up with many southeast asian friends, and that culture largely influenced me.",1,NA,2,2,1,2,13
2025-03-28T14:04:35Z,2025-03-28T14:08:34Z,0,99.184.66.153,100,238,1,2025-03-28T14:08:34Z,R_7Rhcz5n5WP2AGCl,NA,NA,NA,NA,39.0289,-95.2086,anonymous,EN,1,605ab4ac7ee22780d068b662,NA,She is not prolonging her sufferings.  And possible she's not being a financial burden to her family.  This may bring her some peace.,NA,NA,3,5,5,3,5,I'm looking at Sarah's decision.  But I sometimes wonder how much people feel like they are being a burden to their family.  And because of that make a decision that they are not ready to make/would not make if given more options.,no,2,NA,53,5,NA,"I come from a white, midwestern, stable family.",3,UCC,1,1,1,1,5
2025-03-28T14:03:01Z,2025-03-28T14:09:25Z,0,72.45.133.187,100,383,1,2025-03-28T14:09:25Z,R_5P8eay3Fym61Cue,NA,NA,NA,NA,43.3115,-73.6448,anonymous,EN,1,65244c5b802955cb12c8b0b9,"I do not think that Sarah choosing to end her life is causing harm to herself, but rather ending her pain and suffering due to her illness.  The harm would be to her loved ones left behind -  her husband and daughter -- depending on how long it takes them to get through the grief process.",NA,NA,NA,1,7,4,1,5,"I believe that we should all be allowed to have that option if we were diagnosed with a terminal illness, and had only a short time to live.  You could choose to do it or live with the illness, but it would be solely up to you.",NA,2,NA,55,5,NA,"I come from a predominantly white background, with a history of divorces and exposure to a cult.",1,NA,1,1,2,2,1
2025-03-28T14:01:54Z,2025-03-28T14:09:27Z,0,12.75.217.88,100,453,1,2025-03-28T14:09:27Z,R_7GB8DIAe6OFoufe,NA,NA,NA,NA,38.1405,-85.6936,anonymous,EN,1,5c6c90bcf4dc2c0001e8d6d1,NA,NA,NA,I’m not so sure it is.,1,7,3,2,5,I don’t have a solid judgement on it. I’ve never experienced a situation as such.,I don’t feel it’s my place to judge others.,2,NA,43,5,NA,Im from a catholic family raised in the south. I have since released most of the constructs.,1,NA,1,1,3,1,3
2025-03-28T14:02:27Z,2025-03-28T14:10:10Z,0,89.34.228.106,100,462,1,2025-03-28T14:10:11Z,R_6D1vWVSUZNlr6E9,NA,NA,NA,NA,32.505,-92.1239,anonymous,EN,1,67e28cfbd3b9caaf6d72dcd6,by her choosing to end her life it deprived her of a chance to experience some moments of her life that would have been worth living,NA,NA,NA,5,2,1,5,3,she could have waited to experience more time with her family,no,2,NA,49,3,NA,i come from a monocultural background,3,christian,1,2,2,1,4
2025-03-28T14:07:04Z,2025-03-28T14:10:19Z,0,148.74.160.171,100,195,1,2025-03-28T14:10:20Z,R_3ktfvQxrWUlJnf7,NA,NA,NA,NA,40.8102,-72.8279,anonymous,EN,1,6706833dcea7f4813f7ebfb6,Her decision is not causing harm to herself. It is giving herself the power to die with dignity.,NA,NA,NA,1,6,6,3,5,My judgment was influenced by Sarah’s pain,No,2,NA,28,5,NA,"I come from a white European family where I was not exposed to diverse traditions, languages, and customs.",1,NA,1,1,2,2,5
2025-03-28T14:01:18Z,2025-03-28T14:10:21Z,0,139.171.71.160,100,543,1,2025-03-28T14:10:22Z,R_1EnA83jd91caPQt,NA,NA,NA,NA,37.751,-97.822,anonymous,EN,1,67dfcb88b122d76b85f37114,NA,She doesn't endure severe pain,NA,NA,5,3,6,2,2,Ending her life doesn't improve the situation in any way because her family will still be at pain.,"Since she's caring towards her family, she should have shared her struggles with them. Maybe they could have understood her and sympathized with her.",1,NA,26,5,NA,"I come from a family where my parents grew up together as childhood best friends. Therefore, they were from the same culture and I was exposed to both extended families from a young age.",3,Catholic,1,1,2,NA,5
2025-03-28T14:02:09Z,2025-03-28T14:10:32Z,0,139.171.32.63,100,502,1,2025-03-28T14:10:32Z,R_3pmyZwpKTfvQjvg,NA,NA,NA,NA,37.751,-97.822,anonymous,EN,1,67e41371bcf7cfc2860a89f6,NA,She stays away from the agony of seeing her daughter and family in sadness as well as the pain of the symptoms.,NA,NA,1,7,3,5,2,The pain for both Sarah and her family,No,2,NA,47,5,NA,"I come from a cultural family where my parents are from same country, although I am exposed to diverse traditions, languages, and customs from a young age.",3,Christian,2,2,2,2,5
2025-03-28T14:03:28Z,2025-03-28T14:10:39Z,0,128.61.55.86,100,431,1,2025-03-28T14:10:40Z,R_3DpsAIQXULi7x4r,NA,NA,NA,NA,33.7749,-84.3975,anonymous,EN,1,65a68e46526514b6a3da0a10,NA,"If Sarah decided to keep living, she would always be in her head thinking about her illness. She is already in pain and suffering so choosing to end her life ended her suffering. If she kept living, she would be harming herself mentally by always being reminded of her illness and having that internal clock tick down.",NA,NA,2,5,4,3,4,"It was Sarah's decision to ease her pain that brought me to my decision. I feel like I can understand why she chose to do what she did. If I was in pain constantly and had an estimated time of life remaining, I think I could push through but it would be very hard so I get Sarah's decision.",NA,2,NA,19,2,NA,"I come from a family where my parents are from different countries but still speak the same language. I have been exposed to different cultures, languages, and customs.",2,Buddhist,2,2,2,1,1
2025-03-28T14:07:53Z,2025-03-28T14:11:04Z,0,174.240.211.40,100,191,1,2025-03-28T14:11:05Z,R_5s0U0Sz71emRRMJ,NA,NA,NA,NA,39.9843,-75.2266,anonymous,EN,1,5f9c9e203d44de174d8f4f6c,I don't really think that it is causing harm to herself. Maybe the fact that she's going to miss out but that was probably going to happen anyway,NA,NA,NA,2,7,4,4,6,Her life is suffering and in turn it has to hurt her family to watch her suffer I don't see anything wrong with it,No,2,NA,36,5,NA,Irish,1,NA,1,2,1,1,1234
2025-03-28T14:05:50Z,2025-03-28T14:11:34Z,0,76.39.75.131,100,344,1,2025-03-28T14:11:35Z,R_72fqPtgoTxbHndx,NA,NA,NA,NA,44.4489,-88.0604,anonymous,EN,1,67acec8db57cdba0b5e9415e,NA,She is saving herself from pain while also ending the prolonging of the inevitable.,NA,NA,6,4,5,3,3,It can be selfish to take you own life.,Personal experience with suicide,2,NA,26,5,NA,I come from a white family that adopted 2 African American siblings when I was 8.,3,non-denomination,1,1,2,1,5
2025-03-28T14:08:22Z,2025-03-28T14:11:58Z,0,47.145.212.127,100,216,1,2025-03-28T14:11:59Z,R_5SohRqszckruZzX,NA,NA,NA,NA,33.9938,-117.7589,anonymous,EN,1,663ea57212f5d047cf5cb177,NA,She doesn't have to be in pain anymore and her family can let her die in peace without feeling guilty of her pain.,NA,NA,7,7,5,6,8,"Sarah decision and empathizing if I was in that situation, since I have never been.",I wouldn't want to live in pain if I knew I was dying anyway. I don't want to put pressure on my family by having them take care of me while I'm dying.,2,NA,25,7,NA,Mexican american living in california where I'm exposed to many different cultures.,1,NA,1,1,1,2,23
2025-03-28T14:04:44Z,2025-03-28T14:12:21Z,0,47.223.63.33,100,457,1,2025-03-28T14:12:21Z,R_7fdQXgie7Hg2azc,NA,NA,NA,NA,32.1399,-95.3202,anonymous,EN,1,661c1df222d54d2c5ae0b93d,NA,"I guess she ended her chronic pain, although I believe that is incredibly selfish",NA,NA,7,3,7,1,1,"I think it was Sarah’s decision that led my decision. As a mother myself, I can’t imagine taking my own life and having my kids find out that I made that decision.",No,2,NA,35,5,NA,"I come from a single single culture family where my parents are the same race, religion, and language.",3,Christian,1,2,2,1,5
2025-03-28T14:09:32Z,2025-03-28T14:12:38Z,0,16.98.3.150,100,185,1,2025-03-28T14:12:38Z,R_7LtUOtUzshb30Mj,NA,NA,NA,NA,28.2475,-82.4943,anonymous,EN,1,66293c2ca5b9c9d60c040249,NA,NA,NA,I honestly do not think it is reducing harm to others. She has left her husband and child in extreme pain and her daughter now has to grow up without a mother,6,5,5,1,3,I think it is personal experience because losing my parents was the worst pain I have ever gone through,NA,2,NA,48,5,NA,I am a basic white American,1,NA,1,2,2,1,5
2025-03-28T14:06:45Z,2025-03-28T14:13:04Z,0,73.77.139.150,100,378,1,2025-03-28T14:13:04Z,R_3i6sgipvhE3F37H,NA,NA,NA,NA,29.5183,-95.0977,anonymous,EN,1,670181df01d5807d3bca5093,NA,NA,NA,"Sarah ending her life reduces harm to others because she doesn’t want to be seen as a burden on them as her health declines. Not only that, but she’s saving her family from the trauma of watching her slowly decline in health.",7,1,4,2,5,I just felt as if it could be seen as more selfish than selfless. Her young daughter will forever miss those potential five years she might have had with her mother.,"I’m torn, as I’ve always been taught that suicide is a sin. But the intent of her actions were slightly admirable, so it makes it hard to judge.",2,NA,32,8,Biracial (white and Indian),"I’m biracial but was adopted/raised by a Caucasian family, who were very religious (Christian). I was taught traditional values from a young age.",4,Non denominational Christian,1,1,3,1,NA
2025-03-28T14:06:21Z,2025-03-28T14:13:12Z,0,70.170.150.0,100,410,1,2025-03-28T14:13:12Z,R_7EnsWNEwhTYRsc4,NA,NA,NA,NA,36.2474,-115.2185,anonymous,EN,1,669c70be9c7863cefe202855,To spare herself from living in constant pain then dying to her illness and to spare her family from having to watch her live her life suffering and whittle away,NA,NA,NA,3,7,4,6,8,Sympathy and empathy for what she is feeling and going through,NA,2,NA,26,5,NA,White as sliced bread. Grew up in split homes with conservative parents but is gay and liberal,1,NA,2,3,1,1,123
2025-03-28T14:08:36Z,2025-03-28T14:13:41Z,0,71.62.35.210,100,304,1,2025-03-28T14:13:41Z,R_6Ys9yitNaUUEgjl,NA,NA,NA,NA,37.431,-79.1231,anonymous,EN,1,662194a74abe1d4476f358ab,NA,NA,It caused harm for her family members and her young impressionable daughter ! But Sarah’s illness made it hard for her to bear,NA,4,7,6,3,7,Sarah’s decision to ease her pain that caused my judgement,I felt that Sarah felt like her only way out of her ongoing illness was to make a decision to pass away,2,NA,23,5,NA,I come from a family that speak English and have the same background,1,NA,1,1,1,1,1234
2025-03-28T14:05:21Z,2025-03-28T14:13:42Z,0,147.26.5.6,100,500,1,2025-03-28T14:13:42Z,R_7O8mPBmXd0E01XS,NA,NA,NA,NA,29.8737,-97.9361,anonymous,EN,1,6785e704737e7dceb787865b,NA,NA,NA,"While Sarah’s passing is undoubtedly painful for her loved ones, her family finds solace in the fact that she is no longer suffering. Knowing that she made this decision on her own terms may help them process their grief with a sense of acceptance rather than prolonged anxiety over her deteriorating condition.",4,4,4,3,5,"In analyzing Sarah’s decision, I focused on her dual concerns—her own suffering and the well-being of her family. She seems to be making a choice not just to escape her own pain but also to spare her loved ones from the distress of watching her decline. This perspective shaped my response because it highlights how suffering is not just an individual experience; it also deeply affects those who care about us.","Another factor influencing my judgment is my belief in the importance of dignity and agency in the face of terminal illness. While the decision to end one’s life is incredibly complex and deeply personal, I recognize that for some individuals, maintaining a sense of control over their final moments can be an important part of their emotional well-being.

Additionally, my understanding of grief and how people process loss plays a role in my perspective. While losing a loved one is always painful, sometimes anticipatory grief—knowing that someone is suffering and will inevitably pass—can be just as difficult as the loss itself. If Sarah’s family found comfort in knowing that she was at peace, that suggests she made a choice that aligned with her values and her family's emotional needs.

Lastly, I acknowledge that different cultural, religious, and philosophical perspectives influence how people interpret such decisions. While I personally approach this topic with an emphasis on harm reduction, autonomy, and compassion, I recognize that others may see it differently based on their own beliefs. My response is shaped by a respect for individual choice, the complexities of suffering, and the broader ethical questions surrounding end-of-life decisions.








",2,NA,18,5,NA,whhite,4,Christianity,1,1,2,2,5
2025-03-28T14:07:35Z,2025-03-28T14:14:50Z,0,73.252.226.22,100,435,1,2025-03-28T14:14:51Z,R_7S01fL80cWqJ0Yi,NA,NA,NA,NA,37.5659,-122.3661,anonymous,EN,1,5f1279df4a6da41db909db42,NA,NA,NA,Sarah doesn't want her family members to further observe her illness getting worse and to remember her last moments as suffering.,4,5,3,4,5,"I think that at the end of the day, everyone is entitled to the decisions they make about their own lives, including the circumstances of their death. If Sarah believed that ending her life was the right thing for both her as well as her family, then it should be considered to be the right decision.",None,2,NA,24,2,NA,"I come from a family of first generation immigrants, and growing up I spoke my parents' mother tongue at home, rather than my own.",2,Christian,2,2,2,2,1
2025-03-28T14:08:25Z,2025-03-28T14:15:37Z,0,74.135.65.124,100,431,1,2025-03-28T14:15:37Z,R_5b2yJWdNmyGidPP,NA,NA,NA,NA,39.6062,-84.1695,anonymous,EN,1,5a15ef85087f2e0001eaf507,NA,"As she is already suffering, and knows that she has a terminal illness, her continuing on would lead to more and more pain. Ending her life is making where she doesn't have to spend each day in extreme pain and sickness",NA,NA,3,5,5,2,5,"From personal viewpoints, I don't believe that those that choose to end their suffering, especially when you consider that there is no chance of recovering can technically be considered a bad decision if that is what they choose to do to find relief from the situation they are in.","My judgment comes from in some points about the whole right to choose. Yes, her family might be extremely sad, but at the same time, they were not the ones that were having to live through that.",2,NA,39,5,NA,I'm thinking mine has been shaped more by age generation and exposure to internet that has allowed me to shape my own thoughts and views outside most of my familu,2,Christian,1,2,2,1,1
2025-03-28T14:09:39Z,2025-03-28T14:15:38Z,0,136.37.76.9,100,359,1,2025-03-28T14:15:38Z,R_1V2AcMONwu1B6Du,NA,NA,NA,NA,39.1029,-94.5713,anonymous,EN,1,63dc7645c743f938fac18036,"By ending her life, she may give up the long shot of a cure for her terminal illness.",NA,NA,NA,4,4,3,5,5,Sarah's condition was unlikely to get better and was causing her a great amount of pain. She also didn't want to have her young child witness her dying and dealing with the stress for a long term.,Mostly Sarah's family.,1,NA,30,2,NA,My parents were born overseas so I had a multi cultural background where I experienced a blend of my parents culture and my hometown culture.,2,Agnostic,2,2,3,3,4
2025-03-28T14:08:49Z,2025-03-28T14:15:40Z,0,38.186.107.2,100,411,1,2025-03-28T14:15:41Z,R_5JyJETRGsFedrgV,NA,NA,NA,NA,30.5427,-97.5467,anonymous,EN,1,5f32a5b5902e1209aa00dd48,NA,NA,"She isn't giving them a choice. If they had a say and understood her point of view, it may be less harmful to those around her. The PTSD involved with the suicide of a loved one is life long and can also cause copy cat behavior with other loved ones more likely to commit suicide as well.",NA,7,4,7,1,5,Personal experience and my background in mental health influenced my judgement.,"I still think about how things may be different had those I known who took their lives, had not.",2,NA,50,5,NA,I grew up in a broken and poor home. Moving constantly and went to many schools. Very little stayed the same for me.,1,NA,2,2,2,1,3
2025-03-28T14:06:37Z,2025-03-28T14:15:53Z,0,223.29.142.189,100,555,1,2025-03-28T14:15:53Z,R_7MLO2xeBL75yhug,NA,NA,NA,NA,37.751,-97.822,anonymous,EN,1,67dacc346f024afa0a1ad5cf,NA,"Sarah's decision to end her life can be understood as a way to stop the constant physical pain caused by her terminal illness, and to avoid the greater suffering that her doctors predicted would come as the disease progressed. It allowed her to regain a sense of control over her own life, which she might have felt was slipping away due to the illness. By ending her life, she also prevented the potential loss of dignity that often accompanies the final stages of a debilitating disease, and she brought an end to the emotional distress that came with knowing she was dying and in constant pain.",NA,NA,4,4,4,4,4,"My analysis focused solely on the provided text, identifying Sarah's stated reasons for ending her life: stopping her pain, avoiding future suffering, regaining control, preserving dignity, and ending emotional distress. I used logic to explain these points without adding personal opinions or moral judgments.",none,2,NA,69,5,NA,My parents were both white and I was exposed to one background,2,Christianity,1,1,2,1,5
2025-03-28T14:07:37Z,2025-03-28T14:15:59Z,0,161.77.172.254,100,502,1,2025-03-28T14:16:00Z,R_5twQ3ScKBt5PX5n,NA,NA,NA,NA,42.0986,-72.5931,anonymous,EN,1,67e5969d6dc49d614db50593,She will feel more pain leaving her husband and daughter missing her. There is so much fun that is left to share with the family.,NA,NA,NA,6,6,4,6,5,Yes it was her decision but she was in much pain.,None.,2,NA,20,5,NA,"I am monocultural, my parents are both white.",4,Catholic,1,1,1,1,13
2025-03-28T14:12:17Z,2025-03-28T14:16:09Z,0,172.127.12.218,100,232,1,2025-03-28T14:16:10Z,R_3JzuodVBZf9FvKS,NA,NA,NA,NA,34.7483,-89.4875,anonymous,EN,1,558c1c5dfdf99b5d806a0017,The only harm I see to herself is that she will miss out on every last bit of life with her family.  She wont get to see anymore birthdays or christmas's,NA,NA,NA,2,7,5,4,5,"I believe people should have the right to end their own lives if they are in pain and suffering.  IT's a little more gray when kids are involved, but I still believe that sarah made the best decision that she could for her own life and family.  I don't have any experience with this in my life, so I was purely going on how Sarah and her family may feel.",Things like this are none of my business and you should do what makes you happy.,2,NA,43,5,NA,American,1,NA,3,3,2,2,5
