StartDate,EndDate,Status,IPAddress,Progress,Duration..in.seconds.,Finished,RecordedDate,ResponseId,RecipientLastName,RecipientFirstName,RecipientEmail,ExternalReference,LocationLatitude,LocationLongitude,DistributionChannel,UserLanguage,consent,ProlificID,HS,RH.S,HO,RH.O,scale.1,scale.2,scale.3,scale.4,scale.5,explain.1,explain.2,Basic.Q1,Basic.Q1_4_TEXT,Basic.Q2,Basic.Q3,Basic.Q3_8_TEXT,Cultural.demo,Religion.belief.Q1,Religion.belief.Q2,Religion.belief.Q3,Religion.belief.Q4,Self.harm.experience,Self.harm.experience.1,Self.harm.experience.2
2025-03-28T14:29:58Z,2025-03-28T14:35:31Z,0,108.51.29.34,100,333,1,2025-03-28T14:35:31Z,R_7o255u6MXL1Ne77,NA,NA,NA,NA,38.9635,-76.9672,anonymous,EN,1,65eca432fa595679e6cf7bc9,NA,NA,"Sarah’s daughter loses a parent, and her family is left with grief that may hurt less over time, but may never go away. A strain is put on the family, through either loss of income or more money spent on caretaking for her daughter.",NA,4,5,5,3,4,"If a parent brings a child into this world, it is on them to care for the child. Sarah’s situation sucks and being chronically ill, as well as terminal ill, is horrible. But the sentence “she doesn’t know if her symptoms will get worse” made me less sympathetic because I felt like she’s not being proactive enough to manage her symptoms.",I have been diagnosed with depression since the age of 11 and I grew up with my grandparents due to both of my birth parents not wanting to raise children.,2,NA,24,2,NA,"I am Chinese American but given that I was raised by my immigrant grandparents, my upbringing leaned heavily toward Chinese moreso than American. My grandmother is extremely religious.",2,Christianity,2,2,1,2,34
2025-03-28T14:28:48Z,2025-03-28T14:35:37Z,0,98.211.127.92,100,409,1,2025-03-28T14:35:37Z,R_1HeFYMIUfDocXtc,NA,NA,NA,NA,38.8732,-77.1151,anonymous,EN,1,5c35663a24643200010e7e15,NA,She is reducing harm to herself by preventing any future pain and suffering on her part. She didn't want to have a terrible final days with herself and her family going through a great deal of suffering.,NA,NA,3,7,4,5,5,"It was Sarah's decision as she is the one who has to suffer the most through the disease. She has to deal with it's effects on the family as well as her own body. I have no experience with this but it seems similar to abortion in which the host controls what happens, as long as it is within reason and considering others perspectives as well to make a tough decision.",Preventing any pain and hardship costs for the family could put them in a better financial situation than going through treatments,1,NA,29,5,NA,White American,2,Catholic,1,2,2,2,5
2025-03-28T14:25:13Z,2025-03-28T14:35:58Z,0,47.144.58.156,100,645,1,2025-03-28T14:35:58Z,R_3hVqIqkM9SLjr5n,NA,NA,NA,NA,34.2268,-119.0488,anonymous,EN,1,60906c79f8cfd718d6dcb3df,NA,NA,NA,I think it releases her family from the burden of having to watch her suffer day in and day out without being able to help in any way. It allows her family some peace of mind to know that Sarah went out on her own terms and that she doesn't have to suffer anymore.,7,7,5,4,5,"I made my decision based on both Sarah's decision to ease her pain for herself and the pain of her family. I don't feel like I can judge Sarah for her decision because I cannot begin to imagine the pain and suffering her or the family was going through, and my feeling are ultimately neutral towards the overall situation.","No, I have no additional reasons that influenced me to make my judgment.",1,NA,37,3,NA,I don't know what my cultural background is beyond just identifying as African American.,1,NA,1,2,2,2,5
2025-03-28T14:31:31Z,2025-03-28T14:35:59Z,0,76.139.117.14,100,268,1,2025-03-28T14:35:59Z,R_6QKtlllx8nmgjN9,NA,NA,NA,NA,39.903,-86.0636,anonymous,EN,1,6571f6c1cf250f2d56fee114,She didnt know how bad the pain would get or how things would work out so she ended her life.,NA,NA,NA,5,3,7,2,5,It was more personal knowledge /background that led to my judgement.,NA,2,NA,24,3,NA,I come from a all black family with generally similar traditions but have experienced other cultures.,3,christian,1,1,2,2,1
2025-03-28T14:30:04Z,2025-03-28T14:36:27Z,0,50.222.131.50,100,382,1,2025-03-28T14:36:27Z,R_5F9OGKeZ0dhQGPE,NA,NA,NA,NA,29.8284,-95.4696,anonymous,EN,1,5981b8259c83ca00012bddcb,NA,"I suppose that Sarah will no longer have to deal with any pain from the chronic illness, which would have been constant over those next five years.",NA,NA,6,3,5,1,5,I think it was primarily Sarah's own suffering that caused her to end her life. I do think that some of it could have been Sarah not wanting her daughter to see her suffer as well.,Nothing in particular.,1,NA,40,3,NA,United States of America,1,NA,1,1,2,2,3
2025-03-28T14:18:39Z,2025-03-28T14:37:06Z,0,73.244.29.14,100,1107,1,2025-03-28T14:37:06Z,R_3Q0oLiSfFqNMyNJ,NA,NA,NA,NA,26.718,-80.0989,anonymous,EN,1,6640bfba7d66f58accbe7d48,NA,NA,NA,I don't think her decision to end her life is reducing harm to others. Her family will now live in grief especially her daughter but I guess it reduced harm by her not taking it out on others.,7,1,5,3,4,I just think morally it's gross to kill yourself when you have a child even though she supposely had less than 5 years to live doctors can be wrong and that's still a long time to find other solutions.,I think overall it's silly to give up when you have about of time still to keep trying,2,NA,27,8,Mixed,Mom is white (American) and dad is Black (Haitian),1,NA,1,1,2,2,3
2025-03-28T14:26:03Z,2025-03-28T14:37:16Z,0,223.29.141.191,100,672,1,2025-03-28T14:37:16Z,R_72fkbAHl0uB7qZW,NA,NA,NA,NA,37.751,-97.822,anonymous,EN,1,67d3c9e68c8cbb1ab6d913b5,because She didn’t know later be a good parent to her daughter who is young and impressionable.,NA,NA,NA,6,3,7,1,1,her taking a life she didn’t give is not her decision to make,the bible,2,NA,67,5,NA,"I come from a Christian  family where my parents are Christian's, exposing me to diverse traditions, beliefs, and customs from a young age",4,Christianity,1,1,1,1,23
2025-03-28T14:29:43Z,2025-03-28T14:37:59Z,0,104.28.57.222,100,495,1,2025-03-28T14:37:59Z,R_5FRLa7DXJhCD2Ea,NA,NA,NA,NA,40.6744,-73.8016,anonymous,EN,1,6673d8f372e3c2b594f06352,NA,NA,Her decision to end her life is not causing harm to others. Her family is at peace with her death.,NA,6,5,1,7,8,"Based on the background provided to me, I would believe it was Sarah's decision to ease her own pain.",Her family is at peace.,2,NA,30,2,NA,"My parents originate from Burma (Myanmar) and my ancestors are from China, however, I was born in the U.S. My mother adopts a Buddhist lifestyle and her side of the family practices Chinese Traditions. My dad side of the family is more American, but they cook a lot of Burmese food and are somewhat religious. This background has exposed me to diverse foods, languages, people, and ways of life.",1,NA,1,1,2,2,13
2025-03-28T14:04:11Z,2025-03-28T14:38:24Z,0,67.145.12.204,100,2052,1,2025-03-28T14:38:24Z,R_3CVMPVzj7vSUJTg,NA,NA,NA,NA,35.8668,-76.7486,anonymous,EN,1,67e6ec7b78aa9a3f437e56da,NA,NA,"She ended it too soon for her family wasn't expecting her to go that soon, unless she decided fully with her family she doesn't want to suffer anymore then it wasn't causing any harm, just sadness of losing her.",NA,4,6,4,5,5,Sarah's to ease her pain,She doesn't want everyone to see her suffer or feel any suffering more as it gets worse,2,NA,54,3,NA,I come from a diverse traditions since I was young.,4,Christianity,1,1,2,2,5
2025-03-28T14:29:53Z,2025-03-28T14:38:28Z,0,108.12.255.112,100,514,1,2025-03-28T14:38:28Z,R_7KvM9AUQSVoJATT,NA,NA,NA,NA,41.8233,-71.441,anonymous,EN,1,627f448165ed9095fd43cfd1,NA,"I think it reduces both emotional and physical suffering. I think it gives Sarah a comfort knowing that her family will not have to watch her suffer and see that suffering get progressively worse. By ending her life when she chooses to, Sarah may feel that it gives a closure not only to her physical life, but also to emotional suffering her husband and child go through. Needless to say, ending one's life reduces physical pain immediately, and that aspect alone may make Sarah look forward to this ending.",NA,NA,2,6,2,5,7,"I don't have an experience like this, where a family member decided to end their life, so my whole judgment was based on the scenario and my ability to put myself in Sarah's position (or Sarah's mindset). So, ultimately, it was Sarah's decision alone that I considered when making judgment about the scenario.","I think the question of ending one's life as described in this scenario (assisted suicide, euthanasia, etc.) is very complex and, just like in the scenario, it affects more than one person. I tried to look at the scenario from both Sarah's position, but also the position of her husband and child.",1,NA,51,5,NA,"I come from immigrant parents, but was born in the US. I am exposed to familial ties and travel to different cultures and social norms.",1,NA,3,3,2,2,5
2025-03-28T14:24:23Z,2025-03-28T14:38:31Z,0,104.222.28.131,100,847,1,2025-03-28T14:38:32Z,R_1ePzVEH4Al6pDG4,NA,NA,NA,NA,33.42,-111.9128,anonymous,EN,1,5deaa726df55eb1cc1b9474f,NA,NA,NA,"Sarah's decision to send her life is reducing the pain and suffering that they probably would experience if she were to continue living and deteriorating.  Her illness will progress as time moves on.  This will draw out the suffering that she and her family will have to endure.  Assuming that she has explained her feelings / motivations to die quite clearly to her husband and daughter, they can go forward knowing that she made this decision with a clear head and good intent.",7,7,6,7,8,"I've watched a few people go through severe emotional and physical pain.  Some people could endure it better than others.  Most of these people felt fear and guilt over a decision to end their life.  As a result, some of these same people dragged out their decision and, in so doing, may have even caused anger from others.  My nephew finally died last week after a ten+ year battle with depression.  He did not actively seek to end his life.  Instead, he did so passively by ignoring his health to an extreme.  He finally died of heart failure and some people were angry at the way he died.",No,1,NA,70,5,NA,I came from a white (Irish) family and was raised by my widowed mother and her mother (my grandmother) who pretty much overlooked her own crappy marriage.  She stayed in it solely for religious reasons.  Both told meant to bother getting married.  We largely related to working class people and were fine with people of differing ethnic backgrounds.,1,NA,2,2,1,1,5
2025-03-28T14:35:53Z,2025-03-28T14:38:38Z,0,47.24.163.107,100,165,1,2025-03-28T14:38:38Z,R_1fDbIIhGMbYGL0O,NA,NA,NA,NA,38.6433,-90.2574,anonymous,EN,1,614e35b2138b395a5410d87a,NA,NA,"She is depriving them of her love, care, and presence, particularly as a wife and mother.",NA,5,3,6,1,1,Background. Suicide is a moral evil.,NA,1,NA,44,5,NA,American Protestant of European ethnicity.,4,Presbyterian Church in America (PCA),1,1,2,2,5
2025-03-28T14:32:02Z,2025-03-28T14:39:08Z,0,75.153.71.171,100,426,1,2025-03-28T14:39:09Z,R_5rdzcz9nZmBJHL8,NA,NA,NA,NA,51.0807,-113.9572,anonymous,EN,1,67e227d427fb0c335bc74254,sarah didnt want to endure the pain which she wasnt sure when it would end,NA,NA,NA,7,7,6,2,1,she ended her life to ease the pain,no,2,NA,45,5,NA,NA,4,christianity,1,1,2,2,1
2025-03-28T14:35:16Z,2025-03-28T14:39:12Z,0,70.120.155.138,100,236,1,2025-03-28T14:39:12Z,R_31YrAxIVrVXnAkH,NA,NA,NA,NA,32.7666,-97.0075,anonymous,EN,1,60bd88b8fc436774352f53b9,NA,NA,NA,Sarah believes that this decision will reduce the amount of time her family feels stressful negative feelings and worry for her condition and be able to move on sooner,2,7,3,4,4,"I think it was morally right to reduce her pain, but I was concerned that her daughter may not understand the decision made and be hurt by it",n/a,2,NA,22,2,NA,East Asian,1,NA,2,2,2,2,13
2025-03-28T14:27:37Z,2025-03-28T14:40:00Z,0,98.5.179.26,100,742,1,2025-03-28T14:40:00Z,R_5ZTYWpLbWPedr9X,NA,NA,NA,NA,42.5084,-78.6672,anonymous,EN,1,668a7ac9a407373e5cf36bd3,NA,NA,Sarah's family will always wonder if she gave up before a miracle could happen. If she quit too early before a new drug trial was offered she qualified for.,NA,4,4,7,1,1,"I had a friend take his own life because of the pain he was in. There was more to be done, but he didn't give anyone that chance to help him.","I understand ultimately, but part of me still sees it as quitting and giving up. It leaves families shattered.",2,NA,53,5,NA,Traditional white catholic middle class family,3,Roman Catholic,1,1,2,1,5
2025-03-28T14:32:06Z,2025-03-28T14:40:13Z,0,75.7.4.183,100,486,1,2025-03-28T14:40:13Z,R_3nNRKcvml0XxUSy,NA,NA,NA,NA,37.9622,-122.3455,anonymous,EN,1,67292853b40a883abd4ec808,NA,NA,Sarah's decision to end her life is causing harm to others because she is leaving her family (and most importantly young daughter) behind.,NA,1,7,6,2,7,"Given the illness and symptoms had a trajectory of getting worse, it seemed to be a matter of time before Sarah (or any human) couldn't withstand the pain of living further.","Particularly the seemingly negative trajectory. Since we don't know what the future holds, we rely on history and patterns to make judgements.",1,NA,27,5,NA,"I came from a multicultural family (asian and white), raised and currently living in a highly-populated area with much diversity.",2,Christian,1,1,2,2,3
2025-03-28T14:35:33Z,2025-03-28T14:40:21Z,0,71.244.215.137,100,287,1,2025-03-28T14:40:22Z,R_1w4tDuyTX3PvfrU,NA,NA,NA,NA,39.2812,-76.7406,anonymous,EN,1,65cb73de6c90b1640121f7b5,NA,NA,"Sarah saw her mother end her life, affecting her mental health for years, as well as her husband and other family members.",NA,7,5,6,3,4,"Not ever having been in the situation, I assume Sarah must have been in a great deal of pain to end her life. It's not a situation I completely understand, but I tried to empathize with her.",NA,1,NA,33,3,NA,"A highly religious, global black family.",4,Christian,1,1,1,2,123
2025-03-28T14:32:48Z,2025-03-28T14:40:24Z,0,108.45.131.193,100,455,1,2025-03-28T14:40:24Z,R_1TF5A4BgX47KTez,NA,NA,NA,NA,38.8616,-77.2663,anonymous,EN,1,603e97018512c2f752512f0b,NA,NA,NA,"She is trying to save her family from her slow, painful, decline and give them something quick so they can get over her more quickly.",7,5,4,5,5,"I think it was a VERY personal decision. I cannot imagine what that feels like to make that decision, but I can try and understand how to cope, were someone I loved to do that same example. I am not equipped to judge the rightness of wrongness, rather it was the best decision they felt they had to make.",Nothing else comes to mind.,1,NA,46,5,NA,"I am from a middle class white family, that came from generations of middle class white families before them. Literally quite vanilla.",1,NA,1,2,1,3,5
2025-03-28T14:28:54Z,2025-03-28T14:40:47Z,0,161.77.187.189,100,712,1,2025-03-28T14:40:48Z,R_5477okdGJlyyVvp,NA,NA,NA,NA,42.0986,-72.5931,anonymous,EN,1,67e5a7423edb439e16d8b830,NA,NA,"Sarah's decision to end her life causes harm to others in several ways. Her family, particularly her young daughter and husband, will experience intense grief, confusion, and emotional trauma. The daughter may struggle with abandonment and guilt, and the family could face strain in their relationships due to differing views on Sarah's choice. Socially, they might face stigma or isolation, and healthcare providers could feel a sense of failure in not alleviating her suffering. Overall, Sarah's decision has a lasting emotional and psychological impact on her loved ones, shaping their views on life, death, and coping with adversity.",NA,6,5,6,6,8,"My judgment was influenced by the emotional and psychological impact Sarah’s decision would have on her family, especially her young daughter, who could experience lasting grief and confusion. I also considered the ethical complexity of such a decision and the potential long-term effects on family relationships. My understanding of human relationships and grief, combined with the recognition that suffering affects both the individual and those around them, shaped my perspective. Ultimately, while easing personal suffering is important, the harm caused to loved ones left behind was a significant factor in my judgment.","In addition to the emotional and ethical factors, my judgment was influenced by Sarah's responsibility as a parent, as her decision could negatively affect her daughter’s emotional development. I also considered the potential for her choice to normalize suicide as an escape from suffering, impacting others in similar situations. Lastly, the uncertainty of medical advancements and potential relief through treatments made me cautious about the finality of her decision. These factors, combined with the earlier points, shaped my perspective on the harm Sarah's decision could cause to her family.",1,NA,31,3,NA,"I come from a monocultural society environment is one that is centered around a single culture, with little to no diversity in terms of ethnic groups, languages, or traditions.",2,Christianity,1,1,1,1,34
2025-03-28T14:31:44Z,2025-03-28T14:41:23Z,0,107.182.205.58,100,578,1,2025-03-28T14:41:24Z,R_3iFjXAx0LjsChDu,NA,NA,NA,NA,41.6581,-90.5846,anonymous,EN,1,62d0d83f6cb9f6d89cead14d,NA,"Sarah prevents herself from experiencing future harm, as she will no longer be alive to do so. She won't experience the worsening effects of the disease on her body.",NA,NA,3,5,3,3,7,"I think it was ultimately Sarah's choice to make. If there was no other option than to live in misery for five years, then it was a justified decision. I personally would not want to live like that myself, and  could see myself doing the same if I were in her shoes.",NA,2,NA,26,5,NA,"I come from a midwestern, middle-class household. I didn't experience very many cultures growing up - just a typical American upbringing. My parents were heavily christian, but I drifted away from that religion over time.",2,Agnostic,2,2,2,2,13
2025-03-28T14:30:18Z,2025-03-28T14:41:30Z,0,172.56.168.81,100,671,1,2025-03-28T14:41:30Z,R_7gAmm8bkszI84ut,NA,NA,NA,NA,38.4799,-121.4451,anonymous,EN,1,6131ed11a918100d4f4a2452,NA,NA,NA,Sarah choosing to end her life before symptoms get worse could reduce the harm she may inflict on others as her tolerance for the pain she's in might start to change who she is as a person or how she reacts (she may become angrier or act more harshly) so she is preserving other's good memory of her. She is also reducing the amount of time her loved ones must watch her suffer which may ease their mental suffering which could go on for years.,5,6,4,4,5,"It was a bit of both, Sarah was suffering and both her and her family knee she wasn't going to survive. She was constantly ill and was aware of how her pain was affecting the family so even though it's harder on the family in the short run she made a decision for everyone of her own judgment and I have to respect that.",NA,2,NA,25,8,White/Asian,I come from a multicultural background where my parents were born in different countries however my father (who wasn't born in the US) has had little part in teaching cultural traditions or celebration and that influence has come from my grandparents who do expect aspects of their culture to be learned and practiced.,4,Christian (Baptist),1,3,2,2,1
2025-03-28T14:05:14Z,2025-03-28T14:41:54Z,0,92.113.6.94,100,2199,1,2025-03-28T14:41:54Z,R_7hMw18vlvKlEjxY,NA,NA,NA,NA,36.8962,-106.5779,anonymous,EN,1,67e5cc6cc3d974e38560d65a,NA,"Sarah’s decision reduces harm to herself by preventing prolonged physical suffering, emotional distress, and loss of autonomy. She avoids worsening pain, anxiety, and the mental toll of a deteriorating condition. Additionally, she maintains control over her life and spares her family from witnessing her prolonged suffering.",NA,NA,4,7,6,6,8,My judgment was based on Sarah’s choice to ease her own suffering and maintain autonomy. The focus was on minimizing harm rather than personal experience and background.,"My judgment is also influenced by ethical considerations of personal choice, quality of life, and the right to avoid unnecessary suffering.",1,NA,22,3,NA,"I come from a complete black family with parents from diverse backgrounds. My culture emphasizes on strength, collective support, and the importance of enduring hardships for loved ones. However, attitudes toward autonomy, medical decisions, and end-of-life choices can vary based on personal beliefs, religious influences, and regional traditions.",3,I am a protestant but do not go to church every week.,1,2,2,1,1
2025-03-28T14:26:45Z,2025-03-28T14:42:29Z,0,109.121.38.58,100,943,1,2025-03-28T14:42:29Z,R_1pm1ERyXaCJcrRJ,NA,NA,NA,NA,40.7126,-74.0066,anonymous,EN,1,67e28d760d64c66d2bd523ef,NA,NA,NA,"Sarah’s decision, though heartbreaking, lessens the burden on her loved ones in several ways.

Easing Emotional Pain – Her husband and daughter no longer have to watch her suffer every day, which can be just as painful as the illness itself.

Protecting Her Daughter’s Memories – She wants her child to remember her as a loving, present mother rather than someone fading away in pain.

Lessening the Strain on Her Family – Long-term care is exhausting, emotionally and financially. By making this choice, she spares her family from watching her slowly decline.

Giving Them Peace – Though they grieve, they find comfort knowing she’s no longer in pain and can remember her with love, not sorrow.

Sarah’s choice wasn’t easy, but in her own way, she was trying to protect the people she loved most.",3,3,4,3,4,"My judgment was shaped by Sarah’s deep love for her family and her desire to spare them from suffering.

She Wanted to Protect Them – She knew her husband and daughter were hurting just as much as she was, and she didn’t want them to watch her slowly fade away.

The Pain of Watching a Loved One Suffer – It’s heartbreaking to see someone you love in constant pain, and Sarah likely felt that her family didn’t deserve to go through that.

She Wanted Her Daughter to Remember Her as She Was – Instead of being defined by her illness, she wanted her child to hold on to memories of a happy, loving mother.

She Didn’t Want to Burden Them – Beyond the emotional toll, she understood that long-term illness can drain a family physically, financially, and mentally.

At its core, Sarah’s choice wasn’t just about ending her own pain. It was about protecting the people she loved most.","My judgment comes from a place of empathy and understanding of how illness affects not just the person suffering but their loved ones, too.

I’ve Seen How Hard It Is to Watch Someone You Love Suffer – The pain isn’t just physical; it’s emotional for everyone involved. Sarah didn’t want her family to go through that helplessness.

She Wanted to Be Remembered for Who She Was, Not Her Illness – I can understand why she’d want her daughter to hold on to happy memories rather than ones of her fading away in pain.

Illness Changes Everything for a Family – It’s not just about medical bills or exhaustion—it’s about watching someone you love slip away bit by bit. Sarah may have wanted to spare her family from that slow heartbreak.

Love Sometimes Means Letting Go – This wasn’t an easy choice, but I believe Sarah made it out of love, wanting peace for herself and those she cared about most.

At the heart of it, my judgment is shaped by compassion for Sarah, her family, and anyone who has ever had to say goodbye too soon.",2,NA,36,3,NA,"I grew up in Wyandanch, New York, where family, community, and resilience mean everything. Being Black in America comes with challenges, but it also comes with a deep sense of pride and culture. My upbringing was shaped by the strength of my elders, the lessons they passed down, and the unbreakable bonds of my community.

Church on Sundays, family cookouts, and music especially hip-hop and R&B were a big part of my life. I’ve seen struggle, but I’ve also seen incredible perseverance and love. Growing up in an underserved neighborhood taught me the value of hard work, looking out for my own, and never forgetting where I come from. My culture isn’t just about where I live. It’s about the people, the history, and the values that shaped me into who I am today.",3,Christian,1,2,1,1,1
