StartDate,EndDate,Status,IPAddress,Progress,Duration..in.seconds.,Finished,RecordedDate,ResponseId,RecipientLastName,RecipientFirstName,RecipientEmail,ExternalReference,LocationLatitude,LocationLongitude,DistributionChannel,UserLanguage,consent,ProlificID,HS,RH.S,HO,RH.O,scale.1,scale.2,scale.3,scale.4,scale.5,explain.1,explain.2,Basic.Q1,Basic.Q1_4_TEXT,Basic.Q2,Basic.Q3,Basic.Q3_8_TEXT,Cultural.demo,Religion.belief.Q1,Religion.belief.Q2,Religion.belief.Q3,Religion.belief.Q4,Self.harm.experience,Self.harm.experience.1,Self.harm.experience.2
2025-03-28T14:11:21Z,2025-03-28T14:24:58Z,0,109.121.36.188,100,816,1,2025-03-28T14:24:58Z,R_5NrZ6eUrxtD2p1K,NA,NA,NA,NA,40.7126,-74.0066,anonymous,EN,1,67e581adb3aa7ac401b7f29f,NA,NA,NA,"Sarah’s decision to end her life can be viewed as reducing harm to others in several ways, particularly from an emotional and psychological perspective.

Reducing the Emotional Burden on Her Family:

Sarah’s illness causes visible suffering, which deeply affects her husband and daughter. Witnessing a loved one in constant pain can be emotionally distressing and traumatic, especially for a young child. By ending her life, Sarah spares her family from witnessing the prolonged progression of her illness, potentially shielding them from the psychological toll of watching her deteriorate.

Preventing Future Suffering for Her Daughter:

As Sarah’s condition worsens, her ability to care for her daughter may decline, potentially leading to feelings of helplessness and confusion in the child. Young children may struggle to process the gradual loss of a parent, which can have long-term emotional effects. By choosing to end her life before reaching a more critical state, Sarah may be attempting to reduce the extent of trauma her daughter experiences.

Easing the Burden on Her Husband as a Caregiver:

Terminal illnesses often place a heavy burden on caregivers, both emotionally and physically. Sarah’s husband would likely need to devote significant time and energy to providing care, which could impact his well-being and ability to maintain a stable environment for their child. Sarah’s choice may be an attempt to spare him from the prolonged stress and exhaustion of caregiving.

Providing a Sense of Closure:

While Sarah’s death causes initial grief, her family takes comfort in knowing that she is no longer suffering. Prolonged terminal illnesses can create an atmosphere of uncertainty and dread, where loved ones constantly anticipate worsening symptoms. Her decision may allow her family to grieve her loss while also finding solace in the idea that she is now at peace.",4,4,5,5,5,"My judgment was influenced by a combination of ethical reasoning, empathy, and an understanding of the psychological impact of terminal illness on both the patient and their loved ones.

Key Factors That Influenced My Judgment:
Sarah’s Decision to Ease Both Her Pain and Her Family’s Pain:

Sarah’s choice to end her life appears to be driven not just by her own suffering but also by a desire to protect her family from witnessing her prolonged decline. This dual motivation shaped my perspective, as I recognize that suffering is not just physical but also emotional, and it extends beyond the individual to their loved ones.

The Emotional and Psychological Toll of Terminal Illness:

Watching a loved one battle a terminal illness can be mentally and emotionally exhausting. I considered the impact of Sarah’s suffering on her daughter and husband, acknowledging that prolonged distress and caregiving responsibilities could take a toll on them.

The Concept of Autonomy and Dignity in End-of-Life Decisions:

I believe that people should have agency over their lives, especially in cases of extreme suffering with no prospect of recovery. Sarah’s decision reflects an assertion of control over her circumstances, which I see as an important factor in end-of-life ethics.","Ultimately, my judgment was shaped by the interplay between compassion, the recognition of suffering, and respect for autonomy. While Sarah’s decision may not be the only option, I understand why she made it and how it could be seen as reducing harm.",2,NA,39,5,NA,"I come from a multicultural family where my parents are from different countries. However, the cultures are quite similar.",3,Christianity,1,1,2,1,123
2025-03-28T14:06:44Z,2025-03-28T14:25:06Z,0,75.106.60.106,100,1102,1,2025-03-28T14:25:06Z,R_5jPB0P8kJRr0K2d,NA,NA,NA,NA,37.751,-97.822,anonymous,EN,1,5d52aab4d01b31001941a7f1,NA,NA,"She has knowing left her daughter motherless. It is possible that depending on how young her daughter is, she won't remember her. Whether or not she does, there will definitely be a void in her life that will be continually vacant.",NA,4,6,7,3,3,"It is a situation that would be bad for the family no matter which option she chose. But by choosing to end her life prematurely it didn't allow for the family to prepare for their grief. While I believe her decision is somewhat bad, I can certainly understand the desire that Sarah had to end her suffering and hopefully aid in helping her family move on without her by not letting them see her deteriorate any further. I based my judgment on the scenario given, not personal experience.",Nothing that I have not shared already.,2,NA,45,5,NA,I come from a working class family in the rural midwest. My parents divorced when I was five.,1,NA,2,2,2,2,5
2025-03-28T14:20:02Z,2025-03-28T14:25:53Z,0,75.87.119.133,100,351,1,2025-03-28T14:25:53Z,R_5TuuihxpcL03ZG3,NA,NA,NA,NA,27.7077,-97.3551,anonymous,EN,1,5e13ad514c81b2a01ae4aa9f,NA,NA,NA,Sarah decided to end her life because she didn't want her daughter to see her pain during the final years of the illness.,6,7,5,3,5,I think it's such a sticky situation. I do think disabled people should be allowed to end their lives on their own terms.,NA,2,NA,37,5,NA,"I am from the United States. I was raised my mom and grandma. My maternal side is German-Czech with ancestors who came prior to 1900s. I have other European ancestry on my biological father's side but he has never been in my life. I was raised Catholic but that's no longer my religion. I am agnostic in terms of religion, leftist/liberal/Democratic in terms of politics.",1,NA,2,2,2,2,5
2025-03-28T14:15:35Z,2025-03-28T14:26:05Z,0,71.74.128.67,100,630,1,2025-03-28T14:26:05Z,R_3lvQScIquSXyGqZ,NA,NA,NA,NA,41.4296,-82.2047,anonymous,EN,1,67e6de56f2b4afd3c18a5077,NA,NA,She was selfish in what she did. Even though she was dying she could have shown perseverance to her daughter by not giving up.,NA,7,1,7,1,1,She did not ease the pain of her family.,Suicide is giving up. My younger brother was diagnosed with a rare disease that was supposed to kill him before he turned 18. He fought and lived till he was over 27 years old.,1,NA,52,5,NA,I come from a very strict and religious family.,2,Catholic,2,1,2,1,5
2025-03-28T14:18:52Z,2025-03-28T14:26:19Z,0,73.97.222.79,100,447,1,2025-03-28T14:26:20Z,R_76hSCGZEaa1UwGk,NA,NA,NA,NA,47.63,-122.2972,anonymous,EN,1,67a3b2c9f63b0c89ee6e3c49,NA,NA,She is ending her life when there could potentially  be other options and taking away the mother and wife role from her family,NA,5,6,5,4,3,Both influenced my decision,There are many people who have survived longer when being given 5 years to live and perhaps there could be a trial study to help with the pain,2,NA,41,5,NA,"white, parents both American",3,protestant,1,1,2,1,5
2025-03-28T14:14:54Z,2025-03-28T14:26:30Z,0,92.112.55.107,100,695,1,2025-03-28T14:26:30Z,R_6jZetOIru2ituNz,NA,NA,NA,NA,34.0544,-118.244,anonymous,EN,1,67e490097896ae803bd5629f,NA,"Her decision freed her from the constant pain she had to bear due to the disease. Also, it saved her from the mental stress of thinking about what she is making her family go through and the fear of the worsening symptoms",NA,NA,6,4,5,3,2,I would say it Sarah's decision,I think suicide is never the solution,2,NA,29,3,NA,I come from a monocultural family where my parents are from the same country,3,Christian,1,1,2,2,5
2025-03-28T14:21:12Z,2025-03-28T14:26:31Z,0,89.42.81.8,100,319,1,2025-03-28T14:26:32Z,R_1od7TW8sEWrZ7Y3,NA,NA,NA,NA,40.7126,-74.0066,anonymous,EN,1,67e427bc945ca83df5275a6e,NA,NA,NA,This is because her illness has no cure and only makes her family suffer both financially and emotionally.,7,1,4,7,8,Sarah's decision to ease her pain,My personal experience,2,NA,38,3,NA,I come from the black American background where race is a real deal to succussed in life,3,I am a Christian,1,1,1,1,1234
2025-03-28T14:21:31Z,2025-03-28T14:27:03Z,0,68.109.242.122,100,331,1,2025-03-28T14:27:03Z,R_7fIW91CfNpHC2n2,NA,NA,NA,NA,35.5474,-97.5725,anonymous,EN,1,67a7c43e9fee63cbe222ab96,NA,NA,"I don't know that it really causes true harm, but it does create a deep sadness which would lead to depression that could lead to self-harm by the spouse or child left behind.",NA,7,4,4,1,4,"It's really hard to say what is ""right"" or ""wrong"" about a decision that was made in this example. There was probably pain for both Sarah and her family, but Sarah ending her life may have only eased her own pain and not the pain of the family. 

Loss of life is always sad, even for people who live to 100, but sometimes it may overall be the better option when considering quality of life for Sarah and quality of life for Sarah's family (i.e. not having to spend all their time caring for her, etc.)",NA,2,NA,32,5,NA,I have the typical American cultural background rooted in Christianity.,4,Non-denominational Christian,1,1,2,2,1
2025-03-28T14:19:54Z,2025-03-28T14:27:04Z,0,75.187.226.23,100,429,1,2025-03-28T14:27:04Z,R_3Mru5tBl9uKgkne,NA,NA,NA,NA,41.2426,-82.6157,anonymous,EN,1,66a3b470033139dac724e8b3,NA,NA,"Her daughter will suffer greatly not having her mother around, her husband is left alone to raise the child without support from his wife.",NA,3,6,5,3,3,"It was both, I understand the pain of illness and facing death your own way","I probably would make the same decision,  however my children are adults.",2,NA,46,5,NA,"Born and raised in Northeast Ohio, my parents both were born in ohio, we have family ties to West Virginia.",1,NA,1,1,1,2,1234
2025-03-28T14:18:17Z,2025-03-28T14:28:09Z,0,99.189.157.78,100,592,1,2025-03-28T14:28:09Z,R_7F53HzBqi2R7hHO,NA,NA,NA,NA,35.5637,-97.6408,anonymous,EN,1,5fe60e02c64c9641da0fa5cb,NA,She doesn’t know if she can take the process of dying. It has been painful and she’s ready to be done with it. She also doesn’t want her family to see her suffer so much.,NA,NA,3,5,5,5,5,I think it’s easy to judge someone for killing themselves when you don’t have all of the information. It sounded like she wanted to give herself and family peace. I would not want someone to judge me in that situation. I think morally it’s not up to me when it’s someone else’s life. I also think we let some people hang on too long because it is too hard to let them go.,I believe that this should be up to the person who is being affected. I would hope that she talked to her spouse or a close friend to work through it. I know it would be hard for those left behind but I feel like she did it out of love.,2,NA,56,5,NA,"I come from a very “white” family that really didn’t talk about things like this. You did things because that is how they have always been done. You don’t talk about things that hurt or cause problems, because you just push through it.",1,NA,1,1,1,2,123
2025-03-28T14:05:32Z,2025-03-28T14:28:31Z,0,67.250.208.121,100,1378,1,2025-03-28T14:28:31Z,R_7Lv5K0Tj4azWYkq,NA,NA,NA,NA,40.6295,-74.0938,anonymous,EN,1,67e6c9d4b5737cad7d022bab,NA,"If we assume that death is harmful, then Sarah has caused more harm to herself. If death is a way to end suffering, then Sarah has ended her suffering. This might not be the way her family view her departure. To her husband, she might be at rest and at peace. But, to her daughter, her mom might have completed a selfish act. Sarah's daughter might have enjoyed her mom's living in illness rather being dead, especially if her mom was hiding her pain.",NA,NA,1,4,3,4,5,"It Sarah's decision to ease her pain or the pain of her family, that brought me to ultimately arrive at my judgment. No one, but Sarah could judge how much suffering she could take.",Some questions implied that death was harmful. We just have no way of knowing it.,2,NA,51,8,Black or African,"I come from Africa. There are a lot of beliefs in my country. There are several dialects that people speak. People also share different culture, different ways of life within their community.",2,"I was born and raised Catholic, but I am spiritual as an adult.",1,2,1,2,34
2025-03-28T14:18:23Z,2025-03-28T14:28:53Z,0,86.109.84.13,100,630,1,2025-03-28T14:28:53Z,R_7QGU0ZECa7unzMy,NA,NA,NA,NA,47.4919,19.05,anonymous,EN,1,67d3429b4fd895a6f9d81f2c,NA,"Sarah’s decision to end her life reduces harm by sparing herself from escalating physical pain and the loss of dignity as her illness progresses. It allows her to avoid the emotional distress of becoming increasingly dependent on others, preserving her sense of autonomy. By choosing a peaceful death, she prevents the trauma her daughter might experience witnessing her prolonged suffering. Sarah’s action also relieves her family of the burden of caregiving during her most vulnerable stages. Ultimately, her choice prioritizes a controlled, dignified end over unpredictable and unbearable decline.

",NA,NA,5,5,3,6,5,"Sarah's primary motivation to end her suffering (rather than just sparing her family) most influenced my judgment, as the scenario emphasized her unbearable pain as the central factor. My analysis prioritized ethical principles like autonomy and dignity over personal background, though awareness of end-of-life debates lent empathy to her perspective. The judgment balanced compassion for her plight with acknowledgment of the complex moral and emotional consequences for others.

","Sarah's clear prognosis of worsening pain and limited time made her choice feel like a rational act of self-preservation rather than despair. The fact she prioritized being a ""good parent"" by sparing her daughter prolonged trauma added ethical weight to her decision. My perspective was also shaped by recognizing that judgments about terminal suffering are deeply personal—no outsider can fully measure another's pain or dignity thresholds.

",2,NA,23,3,NA,multicultural,4,"my role is to provide neutral, fact-based analysis while respecting all perspectives.",1,1,1,1,5
2025-03-28T14:21:27Z,2025-03-28T14:29:05Z,0,68.254.135.159,100,458,1,2025-03-28T14:29:05Z,R_3PYq2hUE7hrMjOo,NA,NA,NA,NA,36.2134,-86.7311,anonymous,EN,1,614e07461fd23406f92023c7,NA,"Sarah is already suffering from her illness and, by ending her life, she is reducing harm to herself from a protracted poor quality of life. There is uncertainty about how the symptoms will worsen as the disease advances, and she would be preventing herself from experiencing even more severe symptoms.",NA,NA,3,6,2,5,7,It was largely Sarah's decision to ease her pain that informed my judgment. Personal experience (witnessing my grandmother slowly pass away) and background (geroneuropsychology) are why I arrived at that judgment.,No.,2,NA,36,5,NA,"I come from a relatively sheltered and singular culture background. I grew up in an area that wasn't diverse in terms of race, ethnicity, sexual and/or gender minority status, and disability.",1,NA,2,3,1,1,1234
2025-03-28T14:23:07Z,2025-03-28T14:29:15Z,0,107.2.234.225,100,368,1,2025-03-28T14:29:16Z,R_13pr0hAeFS1eOrv,NA,NA,NA,NA,39.1004,-104.8548,anonymous,EN,1,6478e5fc76f5ecbc4f0ed353,NA,NA,NA,Others do not have to see her suffering more and more as her illness progresses.,3,7,4,5,7,I think it was both. Sarah did not want to suffer and she did not want to put her family through experiencing her suffering. These two combined to ultimately influence my answers.,I sort of put myself in Sarah's shoes. I tried to understand why she would make that decision.,1,NA,29,5,NA,I'm American with my ancestry largely being from the UK as well as Sweden/Denmark. We don't really have any traditions from those countries though.,2,Agnostic,2,2,2,1,1
2025-03-28T14:19:09Z,2025-03-28T14:29:25Z,0,168.73.90.170,100,616,1,2025-03-28T14:29:26Z,R_6KSJxjByGXTjSHL,NA,NA,NA,NA,41.8835,-87.6305,anonymous,EN,1,67902fcf03a279aa5bbaa933,NA,NA,She causes sadness to her family by not being alive.,NA,4,4,6,2,5,Her decision,No,1,NA,49,5,NA,White,2,Baptist,1,2,3,2,1
2025-03-28T14:15:15Z,2025-03-28T14:29:27Z,0,92.113.6.5,100,852,1,2025-03-28T14:29:28Z,R_6oFu361kda3Z1xU,NA,NA,NA,NA,36.8962,-106.5779,anonymous,EN,1,67ccbcc0a659ba65853fbd72,NA,"Avoidance of Severe Physical Pain.
Prevention of Emotional and Psychological Distress",NA,NA,7,1,7,1,1,"My judgment was primarily influenced by Sarah's decision to ease her own pain rather than the pain of her family. The scenario emphasizes that her illness is causing her severe discomfort and that her symptoms are only expected to worsen. Given this, my reasoning was based on the perspective of harm reduction—focusing on how her decision helps her avoid physical suffering, emotional distress, and loss of autonomy.","Additionally, my judgment was shaped by ethical principles such as bodily autonomy and dignity in end-of-life decisions. The idea that individuals should have the right to make choices about their own bodies, especially in cases of terminal illness, played a role in my reasoning.",2,NA,31,3,NA,African American history and resilience,3,Christian,1,1,1,1,12
2025-03-28T14:15:39Z,2025-03-28T14:29:42Z,0,88.209.232.189,100,842,1,2025-03-28T14:29:42Z,R_3ph7tBltsBioS9Q,NA,NA,NA,NA,40.7965,-124.1737,anonymous,EN,1,67dc1a2b60f525e9762e892d,NA,NA,"Emotional Impact on Family – Even though her family understands that she was in pain, they may experience deep grief, guilt, or regret. Her husband and daughter could struggle with feelings of loss, wondering if they could have done more to help her. Her daughter, in particular, may face long-term emotional effects, such as trauma, confusion, or difficulty processing the loss at a young age.

Psychological Consequences – Suicide can have lasting psychological effects on loved ones. Her husband may experience depression or anxiety, while her daughter may develop fears surrounding illness, loss, or abandonment. The way Sarah's life ended may also influence how her daughter perceives coping with hardship in the future.

Strain on Relationships – The grief and pain felt by her family members could lead to strained relationships. Her husband may struggle to navigate life without her, which could affect his ability to parent. Family members might also blame themselves or others, leading to tension.

Impact on Medical Professionals and Community – The doctors and caregivers who worked with Sarah may feel a sense of failure or sadness, knowing she chose to end her life despite their efforts. Additionally, close friends and extended family may feel shocked or hurt by her decision.

Ethical and Moral Considerations – Depending on cultural, religious, or personal beliefs, some people in Sarah’s life may feel that suicide is morally or ethically wrong. This could create inner conflict for her loved ones, especially if they struggle to reconcile their beliefs with their empathy for her suffering.",NA,7,1,7,2,3,"My judgment was influenced by a combination of ethical considerations, empathy, and the broader psychological effects of Sarah’s decision.

One key factor was Sarah’s motivation—she sought relief from her suffering, but she also wanted to protect her family from witnessing her decline. This raises the question: does sparing loved ones from prolonged distress outweigh the pain of sudden loss? While her family may find solace in knowing she is no longer suffering, the emotional impact of her absence could be profound and lasting, particularly for her young daughter.

Additionally, my perspective is shaped by the understanding that grief from suicide often carries complexities that differ from natural loss. Feelings of guilt, unanswered questions, and a sense of abandonment may weigh heavily on those left behind. Psychological studies suggest that survivors of a loved one’s suicide often struggle with unique challenges in processing their grief compared to those who lose someone to illness alone.

Personal experiences and cultural background also influence how one views such decisions. Some may see autonomy over one's end-of-life choices as a fundamental right, while others may prioritize the impact on the community and family. In this case, my perspective leans toward acknowledging both Sarah’s suffering and the unintended harm caused to those who loved her.

Ultimately, the complexity of Sarah’s situation makes it clear that such decisions are deeply personal but also interconnected with the well-being of those left behind.","My judgment is influenced by ethical, psychological, and cultural factors. While I respect Sarah’s autonomy in ending her suffering, her decision deeply impacts her family, especially her young daughter, who may struggle with grief and emotional scars. Studies show that losing a parent to suicide can lead to lasting trauma. Additionally, medical advances or palliative care options could have improved her quality of life. Culturally, views on end-of-life choices vary, balancing personal relief with family impact. Philosophically, suffering can hold meaning, strengthening bonds. Ultimately, Sarah’s choice, while understandable, leaves lasting consequences for those who love her.








",2,NA,21,3,NA,I identify myself as a multicultural individual,3,Christianity,1,1,1,1,123
2025-03-28T14:22:58Z,2025-03-28T14:29:46Z,0,68.186.55.55,100,408,1,2025-03-28T14:29:47Z,R_3Kuq0DYBAfWL0Ci,NA,NA,NA,NA,37.1357,-121.6502,anonymous,EN,1,666312108dab14d3494560c2,"By ending her life she will not be able to spend any more time with her loved ones, she will not make new memories and experience new things in life",NA,NA,NA,7,6,7,6,5,"Yes, I felt this way immediately while reading this paragraph",I feel like I would of done something similar,2,NA,34,5,NA,I came from a family who came from Ukraine and followed a lot of traditions,3,Christian,1,1,2,1,5
2025-03-28T14:25:23Z,2025-03-28T14:30:07Z,0,150.135.165.34,100,283,1,2025-03-28T14:30:07Z,R_76b5mXMvhPM8UU1,NA,NA,NA,NA,32.2503,-110.945,anonymous,EN,1,6643da4813f1eb4877d52fbf,NA,"Instead of letting her body deteriorate and remove her own ability to choose what she wants for herself, she decides to end her life. This allows her the agency to consider her decision and make the correct decision for her. It allows her to experience less pain and mental anguish as well",NA,NA,2,6,2,6,8,It was Sarah's decision. I sympathize with being in constant pain and the pain her family feels watching her.,NA,2,NA,30,5,NA,My dad is from Germany and my mom is from the US. I think this helped me to be open to different experiences.,1,NA,1,1,2,1,13
2025-03-28T14:10:31Z,2025-03-28T14:30:07Z,0,139.171.30.226,100,1175,1,2025-03-28T14:30:08Z,R_5FAzrJ8E83cAXyF,NA,NA,NA,NA,37.751,-97.822,anonymous,EN,1,67e5a0e15ef4a32c0d3393d3,Because it's more painful to end life than being treated and it she also feels a lot of pain to leave her daughter without a mother and her family.,NA,NA,NA,7,3,5,4,1,It was my personal experience,my sister when we were still young experienced such and died,2,NA,68,5,NA,I am native in Tennessee from unicultural family,3,Christian,1,1,2,1,1
2025-03-28T14:27:32Z,2025-03-28T14:30:10Z,0,67.163.8.223,100,158,1,2025-03-28T14:30:11Z,R_6HNWDlLKLYr8SNA,NA,NA,NA,NA,41.7579,-88.2934,anonymous,EN,1,65c79390e4188d52174c8f1d,NA,She will not have to endure futher pain from her sickness.,NA,NA,1,1,5,2,5,Personal experiences led me.,No,2,NA,50,5,NA,NA,1,NA,1,2,2,2,5
2025-03-28T14:16:21Z,2025-03-28T14:30:13Z,0,193.36.163.177,100,831,1,2025-03-28T14:30:13Z,R_5h3H4IRP24GB0ot,NA,NA,NA,NA,34.0544,-118.244,anonymous,EN,1,67e6a14955e0c06b415f9049,NA,NA,"Sarah’s decision, while easing her pain, deeply harms her family. Her daughter may face abandonment trauma and lifelong emotional struggles, while her husband carries guilt and the burden of solo parenting. The loss also strains relationships and leaves lasting grief, despite their relief for her peace.",NA,2,5,7,1,1,The assessment I made carefully considered both Sarah's right to decision-making and the family's welfare through principles of ethics and psychological research related to survivor trauma. Despite viewing her pain with respect I prioritized the fundamental evidence-based effects on her daughter and husband because they would suffer enduring consequences compared to her personal situation.,Observations of suicide loss have influenced my perspective by showing how it affects families emotionally while defining ethical conflicts about weighing individual pain against collective social responsibilities. I acknowledged both Sarah's suffering alongside the resulting consequences that her act left for family members surviving her death.,2,NA,75,5,NA,i am mum of 5 who really value family and embrace culture and religion to the fullest.,4,Christian,1,1,1,1,12
2025-03-28T14:26:14Z,2025-03-28T14:30:17Z,0,136.34.128.139,100,243,1,2025-03-28T14:30:18Z,R_1oBgVnQCCfQfmLT,NA,NA,NA,NA,39.0353,-94.4636,anonymous,EN,1,63112d166c18ea59f6b05400,NA,NA,NA,I don't know if it does other than not having to see her suffer.,5,5,6,5,5,To end her pain and be at peace.,No,1,NA,40,5,NA,White speak English non religious.,1,NA,3,3,2,2,5
